{
  "$schema": "https://json-schema.org/draft/2020-12/schema",
  "$id": "bintanong-session-fact-v1",
  "title": "Private session fact",
  "description": "Anonymous session-only context. Never institutional evidence, never verified, never written to a staff ledger. Confirmation means the student confirmed their own statement.",
  "type": "object",
  "additionalProperties": false,
  "required": [
    "schema_version",
    "namespace",
    "synthetic",
    "fact_id",
    "session_id",
    "origin",
    "confirmation_state",
    "confirmation_evidence_ref",
    "lifecycle",
    "fact",
    "evidence"
  ],
  "properties": {
    "schema_version": {
      "const": "bintanong-session-fact-v1"
    },
    "namespace": {
      "const": "private_session"
    },
    "synthetic": {
      "type": "boolean"
    },
    "fact_id": {
      "type": "string",
      "pattern": "^fact-[a-z0-9-]+$"
    },
    "session_id": {
      "type": "string",
      "pattern": "^sess-[a-z0-9-]+$"
    },
    "origin": {
      "enum": [
        "user_statement",
        "private_upload"
      ]
    },
    "confirmation_state": {
      "enum": [
        "unconfirmed",
        "user_confirmed",
        "user_rejected"
      ]
    },
    "confirmation_evidence_ref": {
      "type": [
        "string",
        "null"
      ]
    },
    "lifecycle": {
      "const": "session_only"
    },
    "fact": {
      "type": "object",
      "additionalProperties": false,
      "required": [
        "key",
        "value"
      ],
      "properties": {
        "key": {
          "type": "string",
          "minLength": 1
        },
        "value": {
          "type": "string"
        }
      }
    },
    "evidence": {
      "type": "array",
      "items": {
        "$ref": "#/$defs/evidence"
      }
    }
  },
  "$defs": {
    "evidence": {
      "type": "object",
      "additionalProperties": false,
      "required": [
        "evidence_id",
        "kind",
        "recorded_by",
        "recorded_at"
      ],
      "properties": {
        "evidence_id": {
          "type": "string",
          "minLength": 1
        },
        "kind": {
          "enum": [
            "byte_hash_check",
            "printed_text_span",
            "reviewer_absence_check",
            "issuing_office_confirmation",
            "approval_request",
            "issuing_office_authorization",
            "issuing_office_rejection",
            "issuing_office_revocation",
            "content_review_record",
            "conflict_referral",
            "issuing_office_resolution",
            "user_confirmation",
            "extraction_audit",
            "extractor_status_label",
            "filename_observation",
            "local_possession_note"
          ]
        },
        "recorded_by": {
          "enum": [
            "researcher",
            "reviewer",
            "issuing_office",
            "system",
            "user"
          ]
        },
        "recorded_at": {
          "type": "string",
          "pattern": "^\\d{4}-\\d{2}-\\d{2}T\\d{2}:\\d{2}:\\d{2}(\\.\\d+)?(Z|[+-]\\d{2}:\\d{2})$"
        },
        "authorization_ref": {
          "type": [
            "string",
            "null"
          ]
        }
      }
    }
  }
}
